{
  "spec_version": "0.1.0",
  "version": 1,
  "about": "Slice of the Postgres serverless protocol conformance corpus: the core, batch and WebSocket families, the parameter encoding of SPEC.md section 4.4 and the level 2 value coercion families of SPEC.md section 6. Cases marked parses_equal pin spellings SPEC.md Appendix B leaves undecided. See CONFORMANCE.md section 7 for what is still missing.",
  "fixtures": [
    {
      "name": "session_settings",
      "description": "Pins the database level settings that change how values are rendered, for sessions opened after the fixture runs.",
      "sql": "DO $$ BEGIN EXECUTE format('ALTER DATABASE %I SET lc_monetary = ''C''', current_database()); EXECUTE format('ALTER DATABASE %I SET datestyle = ''ISO, MDY''', current_database()); EXECUTE format('ALTER DATABASE %I SET intervalstyle = ''postgres''', current_database()); END $$;"
    },
    {
      "name": "scalars",
      "description": "One row of the scalar types whose JSON encoding the spec constrains.",
      "sql": "CREATE TABLE IF NOT EXISTS cf_scalars (id int4 PRIMARY KEY, big int8, price numeric, ratio float8, seen timestamptz, addr inet, host_addr inet, net cidr, ident uuid);\nTRUNCATE cf_scalars;\nINSERT INTO cf_scalars VALUES (1, 9223372036854775807, 1234.5678, 'NaN'::float8, 'infinity'::timestamptz, '10.0.0.0/8'::inet, '192.168.1.1'::inet, '10.0.0.0/8'::cidr, 'a0eebc99-9c0b-4ef8-bb6d-6bb9bd380a11'::uuid);"
    },
    {
      "name": "shapes",
      "description": "Values whose shape, rather than whose scalar encoding, the spec constrains.",
      "sql": "CREATE TABLE IF NOT EXISTS cf_shapes (id int4 PRIMARY KEY, grid int4[], span int4range, spans int4multirange, empty_span int4range, unbounded_span int4range);\nTRUNCATE cf_shapes;\nINSERT INTO cf_shapes VALUES (1, ARRAY[ARRAY[1,2],ARRAY[3,4]], '[1,3)'::int4range, '{[1,3),[5,7)}'::int4multirange, 'empty'::int4range, '(,)'::int4range);"
    },
    {
      "name": "constrained",
      "description": "A table with a named constraint, so an integrity violation carries the fields the client reads.",
      "sql": "CREATE TABLE IF NOT EXISTS cf_constrained (id int4 PRIMARY KEY, email text NOT NULL, CONSTRAINT cf_email_unique UNIQUE (email));\nTRUNCATE cf_constrained;\nINSERT INTO cf_constrained VALUES (1, 'a@example.com');"
    },
    {
      "name": "ranges",
      "description": "A range type over text, which PostgreSQL does not ship.",
      "sql": "DO $$ BEGIN CREATE TYPE cf_textrange AS RANGE (subtype = text); EXCEPTION WHEN duplicate_object THEN NULL; END $$;"
    }
  ],
  "cases": [
    {
      "id": "core/single-object-mode",
      "level": 1,
      "spec": "5.1",
      "fixture": "scalars",
      "note": "Object mode is not what the client asks for, but it is the mode most hand-written consumers use, and rows must be keyed by column name.",
      "request": {
        "path": "/sql",
        "headers": {
          "array_mode": false,
          "raw_text": false
        },
        "body": {
          "query": "SELECT id FROM cf_scalars WHERE id = 1"
        }
      },
      "expect": {
        "status": 200,
        "command": "SELECT",
        "row_count": 1,
        "row_as_array": false,
        "fields": [
          {
            "name": "id",
            "data_type_id": 23
          }
        ],
        "rows": [
          {
            "id": {
              "json": "1"
            }
          }
        ]
      }
    },
    {
      "id": "core/single-array-mode",
      "level": 1,
      "spec": "5.1",
      "fixture": "scalars",
      "note": "What the client always requests. rowAsArray must echo true.",
      "request": {
        "path": "/sql",
        "headers": {
          "array_mode": true,
          "raw_text": false
        },
        "body": {
          "query": "SELECT id FROM cf_scalars WHERE id = 1"
        }
      },
      "expect": {
        "status": 200,
        "row_as_array": true,
        "rows": [
          [
            {
              "json": "1"
            }
          ]
        ]
      }
    },
    {
      "id": "core/empty-result-is-array-not-null",
      "level": 1,
      "spec": "5.1",
      "fixture": "scalars",
      "note": "rows must never be null. A client iterating the result should get an empty list, not a crash.",
      "request": {
        "path": "/sql",
        "headers": {
          "array_mode": false,
          "raw_text": false
        },
        "body": {
          "query": "SELECT id FROM cf_scalars WHERE id = -1"
        }
      },
      "expect": {
        "status": 200,
        "command": "SELECT",
        "row_count": 0,
        "rows": []
      }
    },
    {
      "id": "core/raw-text-mode-returns-strings",
      "level": 1,
      "spec": "5.3",
      "fixture": "scalars",
      "note": "The contrast case for the two response modes. int4 is a JSON number in native mode and a JSON string in raw text mode. This is the mode the client always selects, so a server implementing only native mode fails against the real client while passing most type tests.",
      "request": {
        "path": "/sql",
        "headers": {
          "array_mode": false,
          "raw_text": true
        },
        "body": {
          "query": "SELECT id FROM cf_scalars WHERE id = 1"
        }
      },
      "expect": {
        "status": 200,
        "fields": [
          {
            "name": "id",
            "data_type_id": 23
          }
        ],
        "rows": [
          {
            "id": {
              "json": "\"1\""
            }
          }
        ]
      }
    },
    {
      "id": "core/unprefixed-header-wins",
      "level": 1,
      "spec": "4.1",
      "fixture": "scalars",
      "note": "Both spellings sent with conflicting values. The unprefixed one must win, so array mode is off here despite the prefixed header asking for it.",
      "request": {
        "path": "/sql",
        "headers": {
          "array_mode": false,
          "raw_text": false,
          "spelling": "both"
        },
        "body": {
          "query": "SELECT id FROM cf_scalars WHERE id = 1"
        }
      },
      "expect": {
        "status": 200,
        "row_as_array": false,
        "rows": [
          {
            "id": {
              "json": "1"
            }
          }
        ]
      }
    },
    {
      "id": "core/missing-query-is-rejected",
      "level": 1,
      "spec": "4.2",
      "note": "No fixture needed. A body with no query is a client error and must carry the error shape, not an empty 200.",
      "request": {
        "path": "/sql",
        "headers": {
          "raw_text": false
        },
        "body": {}
      },
      "expect": {
        "status": 400,
        "error": {
          "message_contains": "query"
        }
      }
    },
    {
      "id": "core/empty-query-is-an-empty-result",
      "level": 1,
      "spec": "4.2",
      "note": "No fixture needed. An empty query is a query with no statement, not a missing one: PostgreSQL answers EmptyQueryResponse and Neon renders it as a 200 with empty fields and rows, an empty command and a null rowCount.",
      "request": {
        "path": "/sql",
        "headers": {
          "raw_text": false
        },
        "body": {
          "query": ""
        }
      },
      "expect": {
        "status": 200,
        "command": "",
        "rows": []
      }
    },
    {
      "id": "native/int8-as-string",
      "level": 2,
      "spec": "6.1",
      "fixture": "scalars",
      "note": "The headline rule. A JSON number is a double in JavaScript, so this value would silently become 9223372036854775808.",
      "request": {
        "path": "/sql",
        "headers": {
          "array_mode": false,
          "raw_text": false
        },
        "body": {
          "query": "SELECT big FROM cf_scalars WHERE id = 1"
        }
      },
      "expect": {
        "status": 200,
        "rows": [
          {
            "big": {
              "json": "\"9223372036854775807\""
            }
          }
        ]
      }
    },
    {
      "id": "native/nan-float-does-not-fail-the-response",
      "level": 2,
      "spec": "6.2",
      "fixture": "scalars",
      "note": "JSON has no encoding for NaN. A server that does not handle this does not return a wrong value, it fails the whole response and takes every other row with it. The id column is selected alongside so the failure mode is visible: a broken server returns no rows at all rather than one bad column.",
      "request": {
        "path": "/sql",
        "headers": {
          "array_mode": false,
          "raw_text": false
        },
        "body": {
          "query": "SELECT id, ratio FROM cf_scalars WHERE id = 1"
        }
      },
      "expect": {
        "status": 200,
        "rows": [
          {
            "id": {
              "json": "1"
            },
            "ratio": {
              "json": "\"NaN\""
            }
          }
        ]
      }
    },
    {
      "id": "native/infinite-timestamp-is-a-word",
      "level": 2,
      "spec": "6.3",
      "fixture": "scalars",
      "note": "The worst naive failure in the spec. A decoder representing infinity as an enum emits 1, a number indistinguishable from a value the column could hold.",
      "request": {
        "path": "/sql",
        "headers": {
          "array_mode": false,
          "raw_text": false
        },
        "body": {
          "query": "SELECT seen FROM cf_scalars WHERE id = 1"
        }
      },
      "expect": {
        "status": 200,
        "rows": [
          {
            "seen": {
              "json": "\"infinity\""
            }
          }
        ]
      }
    },
    {
      "id": "native/inet-drops-netmask-only-for-a-host",
      "level": 2,
      "spec": "6.5",
      "fixture": "scalars",